asin,brand,browsenode,colour,crawl_timestamp,delivery_type,discount_percentage,medium,image_name,meta_keywords,name_of_author_for_books,no__of_offers,no__of_reviews,no__of_sellers,other_items_customers_buy,parent___child_category__all,product_details__k_v_pairs,product_name,product_url,rating,sales_price,sales_rank_in_child_category,sales_rank_in_parent_category,seller_id,uniq_id,weight
B07X8MR6PF,JORKK,1968122031,,2020-02-07 08:31:44 +0000,fulfilled_by_merchant,65%,https://images-na.ssl-images-amazon.com/images/I/41bGAb9j1RL.jpg,images-na_ssl-images-amazon_com_images_i_41bgab9j1rl_jpg.png,JORKK Men's Cotton Polo Neck T-Shirt.,,,,,"HILGAR Men's Half Sleeves Polo Neck Dry Fit/Matte T-Shirt, Regular Fit Casual T Shirt with Collar for Men | Concepts Polo Tshirt | Qube By Fort Collins Men's Polo | DEXTER Plain Olive Green Cotton Half Sleeve Polo Tshirt for Men | JORKK Polo Neck T-Shirt in Cotton Fabric | Tnx Men's Cotton T-Shirt | Allen Solly Men's Polo","{'ClothingAccessories': '#1,81,416', 'MensPolos': '#3286'}","{'Item_part_number': 'JRKPLYCOLLER01', 'ASIN': 'B07X8MR6PF', 'Date_first_available_at_Amazon_in': '2 September 2019', 'Customer_Reviews': '3.2 out of 5 stars 3 customer reviews', 'Amazon_Bestsellers_Rank': ""#1,81,416 in Clothing & Accessories (See Top 100 in Clothing & Accessories) #3286 in\xa0Men's Polos""}",JORKK Men's Cotton Polo Neck T-Shirt.,https://www.amazon.in/JORKK-Mens-Cotton-Polo-T-Shirt/dp/B07X9RFBDC/,3.2,279,{'MensPolos': '#3286'},"{'ClothingAccessories': '#1,81,416'}",,bb3f77aa8767e98e97d13abee8616ade,999999999
B07FNBK6Z4,nauti nati,15966953031,,2020-02-06 13:07:06 +0000,fulfilled_by_merchant,,https://images-na.ssl-images-amazon.com/images/I/41o9tIJDlXL.jpg,images-na_ssl-images-amazon_com_images_i_41o9tijdlxl_jpg.png,"nauti nati Girls' Midi Dress,Omega Designs PVT LTD",,,,,nauti nati Girl's Synthetic Trousers Suit | nauti nati Synthetic Dress | nauti nati Girls' Midi Dress | United Colors of Benetton Girls' Regular Fit Plain Jumper | nauti nati Girls' Regular Fit Overalls | nauti nati Girls' Midi Dress | A.T.U.N. All Things Uber Nice Cotton Empire Dress | A.T.U.N. All Things Uber Nice Girls' A-Line Mini Dress | Princess Colouring Book (Giant Book Series): Jumbo Sized Colouring Books (Giant Colouring Book Series),"{'ClothingAccessories': '#1,75,073', 'GirlsDressesJumpsuits': '#2315'}","{'ASIN': 'B07FNBK6Z4', 'Date_first_available_at_Amazon_in': '17 July 2018', 'Customer_Reviews': '3.2 out of 5 stars 3 customer reviews', 'Amazon_Bestsellers_Rank': ""#1,75,073 in Clothing & Accessories (See Top 100 in Clothing & Accessories) #2315 in\xa0Girls' Dresses & Jumpsuits""}",nauti nati Girls' Midi Dress,https://www.amazon.in/nauti-nati-Girls-Dress-NN272-580_Red_5Y/dp/B07FN4N15D/,3.1,401,{'GirlsDressesJumpsuits': '#2315'},"{'ClothingAccessories': '#1,75,073'}",,d1840cd449d694ea537c3654ce88f318,999999999
B078R1G5GP,7 ate 9 Apparel,1968013031,,2020-02-06 17:55:31 +0000,fulfilled_by_merchant,,https://images-na.ssl-images-amazon.com/images/I/41-QI4H41zL.jpg,images-na_ssl-images-amazon_com_images_i_41-qi4h41zl_jpg.png,"7 ate 9 Apparel Kids Fifth Birthday Unicorn T-Shirt 2T,7 ate 9 Apparel,LGSSFIVE03",,2,7,2,Edgewood Toys 24 Make A Unicorn Stickers for Kids - Great Unicorn Theme Birthday Party Favors - Fun Craft Project for Children 3+ - Let Your Kids Get Creative & Design Their Favorite Unicorn Stickers | 18 Pack Unicorn Headbands Party Favors Supplies Cat Ear Headbands Girls Plastic Horn Hairbands for Cosplay Party Birthday Party Halloween Christmas(18 Pack) | Laeacco 5x3ft Photography Background Unicorn Birthday Party Photo Backdrop Background Watercolor Flowers Roses Cute Stars Smiling Face Baby Shower Unicorn Head Sweet Pink Girls Photo Portrait Stduio | French Toast Girls' Long Sleeve Peter Pan Collar Blouse | 30Pack 6in Grosgrain Ribbon Hair Bows Baby Girl's Clips Large Big Hair Bows Clips For Baby Girls Teens Toddlers | Learning Resources Geosafari Jr. My First Microscope,,,7 ate 9 Apparel Kids Fifth Birthday Unicorn T-Shirt 2T,https://www.amazon.in/ate-Apparel-Birthday-Unicorn-T-Shirt/dp/B078R1G5GP/,4,3789,,,,6a601b54d8ba4d64f394b50be460b694,86.2 g
B01BKBMTW4,Vimlon,1968255031,,2020-02-07 00:40:13 +0000,fulfilled_by_merchant,,https://images-na.ssl-images-amazon.com/images/I/41phzBoyRSL.jpg,images-na_ssl-images-amazon_com_images_i_41phzboyrsl_jpg.png,"Patangaa Ethnic Digital Printed Multicolored Readymade Women's Kurti,Patangaa",,,,,,,"{'Item_part_number': 'PAKRR0033-Parent', 'ASIN': 'B01BKBMTW4', 'Date_first_available_at_Amazon_in': '1 February 2016', 'Customer_Reviews': '5.0 out of 5 stars 1 customer review'}",Patangaa Ethnic Digital Printed Multicolored Readymade Women's Kurti,https://www.amazon.in/Patangaa-Digital-Printed-Multicolored-Readymade/dp/B01BBZFVGA/,5,1499,,,,9c19ed1a7143dc51259d923ea1949386,999999999
B073ZZ92JJ,Aliven,1953235031,,2020-02-06 13:11:06 +0000,fulfilled_by_merchant,,https://images-na.ssl-images-amazon.com/images/I/51A5rnyn9gL.jpg,images-na_ssl-images-amazon_com_images_i_51a5rnyn9gl_jpg.png,"3Pcs/Set Kids Baby Girls Dot Wrapped Tops + Big Hole Denim Jeans Pants + Headband Outfits Clothing Set,Aliven",,4,7,4,Fisher Price Smart Phone-Grey | NUK Active Silicone Spout Learning Cup Ladybug 10-Ounce,,,3Pcs/Set Kids Baby Girls Dot Wrapped Tops + Big Hole Denim Jeans Pants + Headband Outfits Clothing Set,https://www.amazon.in/Girls-Wrapped-Headband-Outfits-Clothing/dp/B073ZZ92JJ/,4.1,2565,,,,9e2774a3169d8066ce6f3877f2d75461,213 g
B07K59HW84,GOLDSTROMS,1953301031,Black|Blue,2020-02-06 07:39:44 +0000,fulfilled_by_merchant,,https://images-na.ssl-images-amazon.com/images/I/41neBHgyRKL.jpg,,"GOLDSTROMS Minelli Women Round Neck Rayon Fabric Nursing/Feeding/Maternity Gown,GOLDSTROMS",,,,,EasyFeed Designer Rayon Cotton Maternity/Nursing/Easy Feeding/Breastfeeding/Kurti/Kurta/Dress/Gown/with Zippers for PRE and Post Pregnancy for Women for Photoshoot and Baby Shower | CEE 18 Women's Cotton Rayon A-Line Maternity Kurta/Easy Breast Feeding/Breastfeeding Kurti/Western Dress with Zippers for Nursing Pre and Post Pregnancy | GOLDSTROMS Minelli Women 3/4 Sleeve Rayon Fabric Maternity/Nursing/Feeding Gown | GOLDSTROMS Cotton Tunic Dress | GOLDSTROMS Minelli Women's Full Length Rayon Fabric Maternity/Nursing/Feeding Gown,"{'ClothingAccessories': '#12,62,995', 'MaternityDresses': '#1474'}","{'Item_part_number': 'MTF-RYN-1832', 'ASIN': 'B07K59HW84', 'Date_first_available_at_Amazon_in': '2 November 2018', 'Customer_Reviews': '5.0 out of 5 stars 1 customer review', 'Amazon_Bestsellers_Rank': '#12,62,995 in Clothing & Accessories (See Top 100 in Clothing & Accessories) #1474 in\xa0Maternity Dresses'}",GOLDSTROMS Minelli Women Round Neck Rayon Fabric Nursing/Feeding/Maternity Gown,https://www.amazon.in/GOLDSTROMS-Minelli-Nursing-Feeding-Maternity/dp/B07K5F7RXJ/,5,1199,{'MaternityDresses': '#1474'},"{'ClothingAccessories': '#12,62,995'}",,2bae04ff51fa02cbad37a95e69400981,999999999
B079YZ3BNB,Calvin Klein Jeans,1968094031,,2020-02-07 03:39:07 +0000,fulfilled_by_amazon,45%,https://images-na.ssl-images-amazon.com/images/I/512ITR-yX1L.jpg,,"Calvin Klein Jeans Men's Plain Slim fit Casual Shirt (40I8055100_Standard White_XL),Calvin Klein Arvind Fashion Pvt Ltd,40I8055",,,33,,"Calvin Klein Jeans Men's Striped Slim Fit Casual Shirt (40H6281441_Atlantis_XXL) | Calvin Klein Jeans Men's Striped Slim fit Casual Shirt (40H6281441_Atlantis_L) | Calvin Klein Jeans Men's Checkered Slim fit Casual Shirt (40ZW171010_Black_2XL) | Calvin Klein Men's Striped Casual Shirt | Calvin Klein Jeans Men's Skinny Fit Jeans | Calvin Klein Men's Casual Shirt | Calvin Klein Jeans Men's Slim fit Casual Shirt | Calvin Klein Men's Regular fit Polo | Lee Men's Brady Shirt | Nautica Men's Classic Performance Gingham Button Down Collar Dress Shirt, Tan | Perry Ellis Men's Classic Fit Elastic Waist Double Pleated Cuffed Pant, | Calvin Klein Men's 38 mm Flat Strap Plaque Buckle Belt (Black)","{'ClothingAccessories': '#5,54,955', 'MensCasualShirts': '#30558'}","{'Item_model_number': '40I8055', 'ASIN': 'B079YZ3BNB', 'Date_first_available_at_Amazon_in': '5 July 2018', 'Customer_Reviews': 'Be the first to review this item', 'Amazon_Bestsellers_Rank': ""#5,54,955 in Clothing & Accessories (See Top 100 in Clothing & Accessories) #30558 in\xa0Men's Casual Shirts""}",Calvin Klein Jeans Men's Plain Slim fit Casual Shirt (40I8055100_Standard White_XL),https://www.amazon.in/Calvin-Klein-Sleeve-Standard-Classic/dp/B079YZ3BNB/,4.2,2749,{'MensCasualShirts': '#30558'},"{'ClothingAccessories': '#5,54,955'}",AT95IG9ONZD7S,cf32bba59d47cf060bd1e6f4c9b9548c,999999999
B07CMS4D1K,ChicNChic,1953235031,,2020-02-06 10:18:46 +0000,fulfilled_by_merchant,20%,https://images-na.ssl-images-amazon.com/images/I/51S4bV58EAL.jpg,,"ChicNChic Toddler Baby Girls Summer Clothes Whale Print Top with Plaid Shorts Outfits Set (7T, Pink),ChicNChic,34984J006POLKLJK",,,43,,,,,"ChicNChic Toddler Baby Girls Summer Clothes Whale Print Top with Plaid Shorts Outfits Set (7T, Pink)",https://www.amazon.in/chicnchic-Toddler-Summer-Clothes-Outfits/dp/B07CMS4D1K/,4.3,2349,,,A368CFGDO8H247,8d0562bb3af42773a571f144bfaabf92,118 g
B075T5GYKN,TEXCO,1968543031,Black|Pink|Yellow,2020-02-07 11:11:05 +0000,fulfilled_by_merchant,61%,https://images-na.ssl-images-amazon.com/images/I/41USREhME1L.jpg,,"TEXCO Pink Side Draw Strings Crop Top,Gulmohar Fabrics",,,,,,"{'ClothingAccessories': '#7,14,297', 'WomensTops': '#24561'}","{'Item_part_number': 'TC00D1088-P', 'ASIN': 'B075T5GYKN', 'Date_first_available_at_Amazon_in': '20 September 2017', 'Customer_Reviews': '3.0 out of 5 stars 1 customer review', 'Amazon_Bestsellers_Rank': ""#7,14,297 in Clothing & Accessories (See Top 100 in Clothing & Accessories) #24561 in\xa0Women's Tops""}",TEXCO Pink Side Draw Strings Crop Top,https://www.amazon.in/TEXCO-Mustard-Yellow-Strings-Women/dp/B075T4JV75/,3,499,{'WomensTops': '#24561'},"{'ClothingAccessories': '#7,14,297'}",,14d1f5d82fd46ed03f2545ce5cffde5e,999999999
B07DVDPZCQ,DHRUVI TRENDZ,1968256031,Green|Pink|Red,2020-02-07 07:30:42 +0000,fulfilled_by_amazon,86%,https://images-na.ssl-images-amazon.com/images/I/41GoauxRa-L.jpg,,"Dhruvi Trendz Women's Art Silk Solid Saree With Blouse Piece Material (Red),Dhruvi Trendz,S1116",,,,,Dhruvi Trendz Women's Soft Cotton - Silk Solid Saree With Blouse Piece Material | Dhruvi Trendz Soft Cotton & Silk Saree For Women Half Sarees Under 349 2019 Beautiful For Women saree free size with blouse piece | Dhruvi Trendz Women's Soft Cotton Silk Solid Saree With Blouse Piece Material | DHRUVI TRENDZ Cotton Silk Half Saree | Sugathari Sarees Women's Banarasi Manipuri Silk Saree | LooksGud Dhruvi Trendz Women's Cotton Silk Solid Saree with Blouse Piece Material | Dhruvi Trendz Women's Soft Cotton - Silk Solid Saree With Blouse Piece Material | PERFECTBLUE Women`s Art Silk saree with Blouse Piece(ZikkatVariation) | PERFECTBLUE Cotton Silk with Blouse Piece Saree | Dhruvi Trendz Soft Cotton & Silk Saree For Women Half Sarees Under 349 2019 Beautiful For Women saree free size with blouse piece,,"{'Item_part_number': ""Saree for women's-s1115"", 'ASIN': 'B083QRRVHB', 'Date_first_available_at_Amazon_in': '10 January 2020', 'Customer_Reviews': 'Be the first to review this item'}",DHRUVI TRENDZ Women's Soft Cotton Plain Saree with Blouse Piece Material,https://www.amazon.in/Dhruvi-Trendz-Womens-Blouse-Material/dp/B07DVDPZCQ/,4.5,355,,,AT95IG9ONZD7S,57312a06ba9a01f2e36ac9eeb5abc481,999999999
B07MZ7MFT1,Colt by Unlimited,1967899031,,2020-02-07 07:00:56 +0000,fulfilled_by_merchant,50%,https://images-na.ssl-images-amazon.com/images/I/51vgN79cc6L.jpg,,"Colt Boy's Pyjama Set,Arvind Lifestyle Brands Ltd",,,,,Colt by Unlimited Boys' Regular Fit Cotton Overalls (Pack of 2) | Colt by Unlimited Boys' Regular Fit Cotton Overalls | Colt by Unlimited Boys' Regular Fit Overalls (Pack of 2) | Colt by Unlimited Boys' Plain Regular Fit T-Shirt | Colt by Unlimited Boy's Overalls | Colt by Unlimited Boys' Plain Regular Fit Cotton T-Shirt | Colt by Unlimited Boys' Regular Fit Cotton Overalls | Colt by Unlimited Boys' Regular Fit Cotton Overalls (Pack of 2) | Colt by Unlimited Boys' Sweatshirt | Colt by Unlimited Boys' T-Shirt | Colt by Unlimited Boys' Plain Regular Fit Cotton T-Shirt | Chhota Bheem Boys' Regular Fit Pyjama Set | Colt by Unlimited Boys' Regular Fit Cotton Overalls (Pack of 2) | Colt by Unlimited Boys' Regular Fit Cotton Overalls | Max Boy's Pyjama Set | Colt by Unlimited Boys' Plain Regular Fit Cotton T-Shirt,"{'ClothingAccessories': '#45,930', 'BoysPyjamaSets': '#35'}","{'ASIN': 'B07MZ7MFT1', 'Date_first_available_at_Amazon_in': '21 January 2019', 'Customer_Reviews': '3.6 out of 5 stars 7 customer reviews', 'Amazon_Bestsellers_Rank': ""#45,930 in Clothing & Accessories (See Top 100 in Clothing & Accessories) #35 in\xa0Boys' Pyjama Sets""}",Colt Boy's Pyjama Set,https://www.amazon.in/Colt-Unlimited-Regular-Pyjama-400017633152_White_02Y/dp/B07F13DGYY/,3.6,249,{'BoysPyjamaSets': '#35'},"{'ClothingAccessories': '#45,930'}",,5ea9325bb318f24a421fb88695dfa7d0,999999999
B07VKJ96MK,bluehaaat,1968123031,Black Half|Black Sando|Rust|Black Full|Maroon|Olive|White,2020-02-06 18:01:55 +0000,fulfilled_by_merchant,,https://images-na.ssl-images-amazon.com/images/I/41CRz8eP1DL.jpg,,"bluehaaat Balidan Dena Hoga Sacred Games Quote Printed Cotton Tshirt for Men,bluehaaat",,,,,CottonTee Unisex Secred Game Half Sleeve Cotton Tshirts | 36FAHRENHEIT Aham Brahmasmi Sacred Games Golden Print Unisex Cotton T-Shirt | bluehaaat Aham Brahmasmi Sacred Games Quote Graphics Printed Cotton Tshirt for Men | bluehaaat BHAGWAN KO MANTE HO Sacred Games Quote Printed Cotton Tshirt for Men | Filmy Vastra Sacred Games: Bhagwan Ko Mante Ho Men's T-Shirt | Aaramkhor Sacred Games Round Neck Half Sleeve T-Shirt for Men | Kabhi Kabi Lagta Hai Apun hi Bhagwan Hai | TV Series | bluehaaat Aham Brahmasmi Sacred Games Quote Graphics Printed Cotton Tshirt for Men | bluehaaat BHAGWAN KO MANTE HO Sacred Games Quote Printed Cotton Tshirt for Men | CottonTee Unisex Secred Game Half Sleeve Cotton Tshirts | Filmy Vastra Sacred Games: Bhagwan Ko Mante Ho Men's T-Shirt,"{'ClothingAccessories': '#3,13,023', 'MensT_Shirts': '#24768'}","{'Product_Dimensions': '3 x 20 x 30 cm ; 200 g', 'ASIN': 'B07VKJ96MK', 'Date_first_available_at_Amazon_in': '22 July 2019', 'Customer_Reviews': '5.0 out of 5 stars 1 customer review', 'Amazon_Bestsellers_Rank': ""#3,13,023 in Clothing & Accessories (See Top 100 in Clothing & Accessories) #24768 in\xa0Men's T-Shirts""}",bluehaaat Balidan Dena Hoga Sacred Games Quote Printed Cotton Tshirt for Men,https://www.amazon.in/bluehaaat-Balidan-Sacred-Printed-Sleeve/dp/B07VM4PNFB/,4.5,399,{'MensT_Shirts': '#24768'},"{'ClothingAccessories': '#3,13,023'}",,3916fb6fc88efdd2a9320b65390b2c97,200 g
B01G4FGYKY,MAGSON,1967868031,Argos - Black|Devon - Black|Ethan - Blue|Grand - Brown|Hover - Violet|Kyron - Pink|Lark - Black|Nash - Blue|Pablo - Red|Terra - Yellow|Urbano - Grey|Xena - Blue|Yama - Purple,2020-02-06 17:23:11 +0000,fulfilled_by_amazon,70%,https://images-na.ssl-images-amazon.com/images/I/41UOdBJ6vWL.jpg,,"Magson Neo Men's Micro Fibre Jacquard Narrow Tie, Grand - Brown,Magson Kreations",,,,,,"{'ClothingAccessories': '#3,59,069', 'BoysTies': '#43'}","{'Item_part_number': 'netie2016g', 'ASIN': 'B01G4FGYKY', 'Date_first_available_at_Amazon_in': '24 May 2016', 'Customer_Reviews': '5.0 out of 5 stars 3 customer reviews', 'Amazon_Bestsellers_Rank': ""#3,59,069 in Clothing & Accessories (See Top 100 in Clothing & Accessories) #43 in\xa0Boys' Ties""}",Magson Neo Men's Assorted Tie (2018 collection),https://www.amazon.in/Magson-Micro-Fibre-Jacquard-Narrow/dp/B01G4FGYKY/,5,295,{'BoysTies': '#43'},"{'ClothingAccessories': '#3,59,069'}",A1JMG6531Z3EIJ,20807be4091aa7f42becd3622c8bae3a,999999999
B07F9ZS2PY,Arrow New York,1968096031,,2020-02-07 04:30:25 +0000,fulfilled_by_merchant,60%,https://images-na.ssl-images-amazon.com/images/I/41eHq5xpMuL.jpg,,"Arrow Newyork Men's Checkered Slim Fit Formal Shirt,Arvind Fashions Limited",,,,,Arrow New York Men's Plain Slim fit Formal Shirt | Arrow Newyork Men's Printed Slim Fit Formal Shirt | Arrow Newyork Men's Checkered Slim Fit Formal Shirt | Arrow Newyork Men's Solid Slim Fit Formal Shirt | Arrow Newyork Men's Printed Slim Fit Formal Shirt | Arrow Newyork Men's Slim Fit Formal Shirt | Arrow Men's Solid Slim Fit Formal Shirt | Arrow New York Men's Plain Slim fit Formal Shirt | Arrow Newyork Men's Slim Fit Formal Shirt,"{'ClothingAccessories': '#2,12,941', 'MensFormalShirts': '#6643'}","{'ASIN': 'B07F9ZS2PY', 'Date_first_available_at_Amazon_in': '6 July 2018', 'Customer_Reviews': '5.0 out of 5 stars 1 customer review', 'Amazon_Bestsellers_Rank': ""#2,12,941 in Clothing & Accessories (See Top 100 in Clothing & Accessories) #6643 in\xa0Men's Formal Shirts""}",Arrow Newyork Men's Checkered Slim Fit Formal Shirt,https://www.amazon.in/Arrow-Newyork-Checkered-Formal-ANWSH1050_Blue_40/dp/B07F3HV77V/,4.2,799,{'MensFormalShirts': '#6643'},"{'ClothingAccessories': '#2,12,941'}",,27fe4aa26c05205cbec992efa091a00b,999999999
B07HNQK9JX,Vetrokart,3723378031,,2020-02-07 03:52:24 +0000,fulfilled_by_amazon,60%,https://images-na.ssl-images-amazon.com/images/I/41XFwq3zutL.jpg,,"Vetrokart Women's Tappeta Silk Semi-stitched Lehenga Choli (Blue, Free Size),Vetrokart",,,,,"Dharmi Fashion Women's Silk Lehenga Choli (Blue_Free Size, Semi-Stitched) | Florence Women's Net Embroidered Lehengha Choli(Free Size) | Kedar Fab Women's Taffeta Silk Lehenga Choli With Blouse Piece (free size_Blue_Pink) | Sojitra Enterprise Women's Heavy Embroidered Work Silk Green colour Lehenga Choli (Free Size) | A.R.Sundaram Fashion Women's Velvet Lehenga Choli (ARS-81 _Blue_ Free Size) | Jesti Designer Women's Heavy Embroidered Banglory Silk Taffeta Lehenga Choli for Women Latest Design | Dharmi Fashion Women's Silk Lehenga Choli (Blue_Free Size, Semi-Stitched) | Bhakti Nandan Creation Women's Embroidered Taffeta Silk Semi-Stitched Lehanga Choli (All over 1, Maroon & Blue, Free Size) (Blue) | Alazra Creation Women's Tappeta Silk Lehenga Choli (Blue,Free Size, Semi-Stitched)","{'ClothingAccessories': '#2,74,542', 'WomensLehengaCholis': '#1469'}","{'Item_part_number': 'nidhi-blue-Vetro', 'ASIN': 'B07HNQK9JX', 'Date_first_available_at_Amazon_in': '25 September 2018', 'Customer_Reviews': '4.5 out of 5 stars 10 customer reviews', 'Amazon_Bestsellers_Rank': ""#2,74,542 in Clothing & Accessories (See Top 100 in Clothing & Accessories) #1469 in\xa0Women's Lehenga Cholis""}","Vetrokart Women's Tappeta Silk Semi-stitched Lehenga Choli (Blue, Free Size)",https://www.amazon.in/Vetrokart-Womens-Tappeta-Semi-stitched-Lehenga/dp/B07HNQK9JX/,4.5,519,{'WomensLehengaCholis': '#1469'},"{'ClothingAccessories': '#2,74,542'}",A9RAM2DEMP1NE,a2fef5487083e7a2d17b07fecc46e934,999999999
B0781YW3J2,Rangeelo rajasthan,1968255031,,2020-02-06 07:05:17 +0000,fulfilled_by_merchant,69%,https://images-na.ssl-images-amazon.com/images/I/41FiRDT8FDL.jpg,,"Rangeelo rajasthan Women's Straight Kurta,Sanganer Clothing Pvt.Ltd,RR092ORANGE",,,,,M&D Women's Straight Kurta,"{'ClothingAccessories': '#5,51,468', 'WomensKurtasKurtis': '#36958'}","{'Item_model_number': 'RR092ORANGE', 'ASIN': 'B0781YW3J2', 'Date_first_available_at_Amazon_in': '12 December 2017', 'Customer_Reviews': '3.0 out of 5 stars 1 customer review', 'Amazon_Bestsellers_Rank': ""#5,51,468 in Clothing & Accessories (See Top 100 in Clothing & Accessories) #36958 in\xa0Women's Kurtas & Kurtis""}",Rangeelo rajasthan Women's Straight Kurta,https://www.amazon.in/Rangeelo-rajasthan-Womens-Straight-RR092ORANGE_X-Large/dp/B078214RH4/,3,379,{'WomensKurtasKurtis': '#36958'},"{'ClothingAccessories': '#5,51,468'}",,0f8a3a26f3e563621eda640aa3ecd17e,999999999
B07PHFR4BG,LEADING LADY,1968469031,,2020-02-06 19:45:48 +0000,fulfilled_by_merchant,,https://images-na.ssl-images-amazon.com/images/I/51zWOLsQqAL.jpg,,LEADING LADY Women's Full Cup Non Padded Non Wired Bra (Pack of 2),,,,,"Zunahme Cotton Gym Wear Daily Workout Sports Bra for Girls, Women's Combo (Pack of 3) | BODYCARE Women's Sports Bra | Enamor Non-Padded Wirefree Sports Bra | Enamor Non-Padded Wirefree Sports Bra","{'ClothingAccessories': '#3,87,641', 'WomensSportsBras': '#989'}","{'ASIN': 'B07PHFR4BG', 'Date_first_available_at_Amazon_in': '11 March 2019', 'Customer_Reviews': '4.3 out of 5 stars 5 customer reviews', 'Amazon_Bestsellers_Rank': ""#3,87,641 in Clothing & Accessories (See Top 100 in Clothing & Accessories) #989 in\xa0Women's Sports Bras""}",LEADING LADY Women's Full Cup Non Padded Non Wired Bra (Pack of 2),https://www.amazon.in/Leading-Lady-Womens-Non-Wired-104_Multicoloured_36B/dp/B07PDQ5LDM/,3.6,287,{'WomensSportsBras': '#989'},"{'ClothingAccessories': '#3,87,641'}",,b506a3e484fad8a02f3e491d523476e9,999999999
B081ZBNJ9Z,RIGO,1968123031,,2020-02-06 20:34:49 +0000,fulfilled_by_merchant,,https://images-na.ssl-images-amazon.com/images/I/41q6ydde0sL.jpg,,"RIGO Men's Striped Slim Fit T-Shirt,Rigo International",,,,,RIGO Men's Striped Slim Fit T-Shirt | Cenizas Men's Striped T-Shirt | RIGO Men's Striped Slim Fit T-Shirt | RIGO Men's Solid Slim fit T-Shirt | STYLENSE Men's Half Sleeve Round Neck Cotton T-Shirt - Multicolor | 45 DEGREE Mens Half Sleeve Printed Cotton T-Shirt,"{'ClothingAccessories': '#1,05,754', 'MensT_Shirts': '#7737'}","{'Item_Weight': '150 g', 'ASIN': 'B081ZBNJ9Z', 'Date_first_available_at_Amazon_in': '12 September 2017', 'Customer_Reviews': 'Be the first to review this item', 'Amazon_Bestsellers_Rank': ""#1,05,754 in Clothing & Accessories (See Top 100 in Clothing & Accessories) #7737 in\xa0Men's T-Shirts""}",RIGO Men's Striped Slim Fit T-Shirt,https://www.amazon.in/Rigo-Mens-Striped-T-Shirt-CT09171245_White_L/dp/B075LP18TN/,5,331,{'MensT_Shirts': '#7737'},"{'ClothingAccessories': '#1,05,754'}",,d3c11301dd57ea6ac07dcd7e0eb9c97e,150 g
B073QR8ZX8,Miss Chase,1968543031,,2020-02-07 11:06:24 +0000,fulfilled_by_amazon,65%,https://images-na.ssl-images-amazon.com/images/I/41cRiYKt30L.jpg,,"Miss Chase Womens Pink Off Shoulder Top(MCSS17TP08-04-122-05_Pink_Large),Miss Chase,MCSS17TP08-04-122-05",,,,,PREET GEHNA Women's Off Shoulder summercool Printed top | RARE Women's Regular fit Top | Harpa Women's Plain Regular Fit Top | Miss Chase Women's Blue Denim Off-Shoulder Top | Honey by Pantaloons Women's Floral Regular Fit Top | Amazon Brand - Symbol Women Shirt,"{'ClothingAccessories': '#6,24,750', 'WomensTops': '#21133'}","{'Item_model_number': 'MCSS17TP08-04-122', 'ASIN': 'B07RH2CQ33', 'Date_first_available_at_Amazon_in': '4 July 2017', 'Customer_Reviews': '3.0 out of 5 stars 1 customer review', 'Amazon_Bestsellers_Rank': ""#6,24,750 in Clothing & Accessories (See Top 100 in Clothing & Accessories) #21133 in\xa0Women's Tops""}",Miss Chase Women's Pink Self Design Bardot Neck Half Sleeved Off Shoulder Ruffled Top,https://www.amazon.in/Miss-Chase-Womens-Pink-Shoulder/dp/B073QR8ZX8/,3,469,{'WomensTops': '#21133'},"{'ClothingAccessories': '#6,24,750'}",AT95IG9ONZD7S,c93ba9d0208b354bd64072b9acc566f6,999999999
B07Z23K3DR,SWORNOF,1968256031,,2020-02-06 22:41:55 +0000,fulfilled_by_merchant,73%,https://images-na.ssl-images-amazon.com/images/I/41O6PxBNTiL.jpg,,"SWORNOF Women's Silk Saree With Blouse Piece (Blue),SWORNOF",,,,,,"{'ClothingAccessories': '#13,07,096', 'WomensSarees': '#97073'}","{'Item_Weight': '449 g', 'Item_part_number': 'SWORNOF_8888', 'ASIN': 'B07Z23K3DR', 'Date_first_available_at_Amazon_in': '11 October 2019', 'Customer_Reviews': '5.0 out of 5 stars 1 customer review', 'Amazon_Bestsellers_Rank': ""#13,07,096 in Clothing & Accessories (See Top 100 in Clothing & Accessories) #97073 in\xa0Women's Sarees""}",SWORNOF Women's Silk Saree With Blouse Piece (Blue),https://www.amazon.in/SWORNOF-Womens-Saree-Blouse-Piece/dp/B07Z23K3DR/,5,410,{'WomensSarees': '#97073'},"{'ClothingAccessories': '#13,07,096'}",AS3M4MP1SVSOK,d913747b664df3b062ac5cd6d9cecc74,449 g
B07PY8YPX1,Saheli,1968254031,WHITE|NAVY BLUE|RANI|BLACK|MEHROON|SKIN|SKIN/GOLD|Red|MEHROON 4XL|black|navy blue|MEHROON 5XL,2020-02-07 01:33:09 +0000,fulfilled_by_merchant,,https://images-na.ssl-images-amazon.com/images/I/31lpf2TU9aL.jpg,,"GURUS FOREVER RAYON PLAZZO XXL TO 5XL,FOREVER",,,,,"Dream & Dzire Women's Rayon Palazzo for All Plus Size and Small Size (142) | XXL TO 6XL(ALL PLUS SIZES) SAHELI RAYON PLAZZO | PATRORNA Women's Cotton Silk Regular Flared Palazzo Pant (Multiple Colors, XS-10XL) | Ayesha Creations Palazzo Pants for Women Rayon Free Size | for Any Kurti | Ethnic Or Casual Wear | Yolki Black Palazzo for women's, Flared parallel Bottom, Cotton and Rayon Blend, Length : 39"", Size (XL-5xl) | NATTY INDIA Black Crepe Regular Fit Plazzo | Dream & Dzire Women's Rayon Palazzo for All Plus Size and Small Size (142)","{'ClothingAccessories': '#2,22,025', 'WomensChuridarSalwarBottoms': '#3043'}","{'Item_part_number': 'EW-BW-P', 'ASIN': 'B07PY8YPX1', 'Date_first_available_at_Amazon_in': '25 March 2019', 'Customer_Reviews': '3.9 out of 5 stars 2 customer reviews', 'Amazon_Bestsellers_Rank': ""#2,22,025 in Clothing & Accessories (See Top 100 in Clothing & Accessories) #3043 in\xa0Women's Churidar & Salwar Bottoms""}",GURUS FOREVER RAYON PLAZZO XXL TO 5XL,https://www.amazon.in/Saheli-Forever-Womens-Palazzo-EW-BW-2/dp/B07PZDND75/,3.9,499,{'WomensChuridarSalwarBottoms': '#3043'},"{'ClothingAccessories': '#2,22,025'}",,785694f45aea580a9d0d717b4dbd95e4,999999999
